{
  "$schema": "http://json-schema.org/draft-07/schema#",
  "$id": "https://github.com/phobos-dthorga/phobos-ostranauts/schemas/lenders.schema.json",
  "title": "Phobos lenders data pack",
  "type": "object",
  "additionalProperties": false,
  "properties": {
    "priority": {
      "type": "integer",
      "minimum": -100,
      "maximum": 100,
      "description": "Override files only: files apply lowest first (default 0), so a higher number has a later word. Leave it out unless you need it."
    },
    "schemaVersion": {
      "type": "integer",
      "const": 1
    },
    "schema": {
      "type": "string",
      "const": "lenders"
    },
    "notes": {
      "type": "string",
      "description": "Free text for maintainers; ignored by the game."
    },
    "lenders": {
      "type": "object",
      "additionalProperties": false,
      "patternProperties": {
        "^[a-z0-9]+(-[a-z0-9]+)*$": {
          "type": "object",
          "additionalProperties": false,
          "properties": {
            "notes": {
              "type": "string",
              "description": "Free text for maintainers; ignored by the game."
            },
            "name": {
              "type": "string",
              "description": "The name shown in the app and on the ledger (the creditor): 1 to 40 characters, without | , = # [ ] < >."
            },
            "pitch": {
              "type": "string",
              "description": "The lender's own words to a customer, in their sales voice; at most 400 characters, no placeholders."
            },
            "accredited": {
              "type": "boolean",
              "description": "A registered lender (lower rates, asks for standing) or a quick-money one."
            },
            "home": {
              "type": "string",
              "description": "The story place the lender trades from (a key of Framework places): a regional place lends in its region, a part of one only to a player docked there.",
              "pattern": "^[a-z0-9]+(-[a-z0-9]+)*$"
            },
            "person": {
              "type": "string",
              "description": "The story person who speaks for the lender; optional.",
              "pattern": "^[a-z0-9]+(-[a-z0-9]+)*$"
            },
            "requires": {
              "type": "object",
              "description": "Who may borrow: a story requires block, checked as story content is (see the story schema)."
            },
            "ratePerShift": {
              "type": "number",
              "exclusiveMinimum": 0,
              "maximum": 0.01,
              "description": "Interest per shift on the balance still owed, as a share (0.0003 is 0.03%)."
            },
            "minPrincipal": {
              "type": "number",
              "minimum": 1000,
              "maximum": 5000000,
              "description": "The smallest loan, in credits."
            },
            "maxPrincipal": {
              "type": "number",
              "minimum": 1000,
              "maximum": 5000000,
              "description": "The most the player may owe this lender at once, in credits; above minPrincipal."
            },
            "maxLoans": {
              "type": "integer",
              "minimum": 1,
              "maximum": 5,
              "description": "How many loans from this lender may run at once (default 1)."
            },
            "offers": {
              "type": "array",
              "minItems": 1,
              "uniqueItems": true,
              "items": {
                "type": "string",
                "enum": [
                  "cash",
                  "ship",
                  "home"
                ]
              },
              "description": "What it lends for: cash, ship (a ship broker purchase) or home (an apartment from a real-estate broker)."
            },
            "minDownShare": {
              "type": "number",
              "minimum": 0.1,
              "maximum": 1,
              "description": "For ship and home loans: the least paid down, as a share of the price (default 0.5)."
            }
          },
          "required": [
            "name",
            "pitch",
            "home",
            "ratePerShift",
            "minPrincipal",
            "maxPrincipal",
            "offers"
          ]
        }
      },
      "description": "Lenders by id (lowercase words joined by dashes, at most 32 characters)."
    },
    "creditLines": {
      "type": "object",
      "additionalProperties": false,
      "patternProperties": {
        "^[a-z0-9]+(-[a-z0-9]+)*$": {
          "type": "object",
          "additionalProperties": false,
          "properties": {
            "notes": {
              "type": "string",
              "description": "Free text for maintainers; ignored by the game."
            },
            "name": {
              "type": "string",
              "description": "The service name shown in the app and on the ledger: 1 to 40 characters, without | , = # [ ] < >."
            },
            "pitch": {
              "type": "string",
              "description": "The service's own words to a customer; at most 400 characters, no placeholders."
            },
            "person": {
              "type": "string",
              "description": "The story person who speaks for the service; optional.",
              "pattern": "^[a-z0-9]+(-[a-z0-9]+)*$"
            },
            "requires": {
              "type": "object",
              "description": "Who may open the line: a story requires block; none means anyone."
            },
            "limit": {
              "type": "number",
              "minimum": 1000,
              "maximum": 1000000,
              "description": "The most that may be owed on the line, fee included, in credits."
            },
            "ratePerShift": {
              "type": "number",
              "exclusiveMinimum": 0,
              "maximum": 0.01,
              "description": "Interest per shift on the balance, as a share."
            },
            "drawFee": {
              "type": "number",
              "minimum": 0,
              "maximum": 0.2,
              "description": "The fee on each draw, as a share of the amount drawn, added to the balance."
            },
            "minDraw": {
              "type": "number",
              "minimum": 100,
              "maximum": 1000000,
              "description": "The smallest draw, in credits (default 500); with its fee, within the limit."
            }
          },
          "required": [
            "name",
            "pitch",
            "limit",
            "ratePerShift",
            "drawFee"
          ]
        }
      },
      "description": "System-wide credit lines by id (Phobos Banking 0.6.0): opened and drawn on from anywhere; ids must differ from every lender id, at most 31 characters."
    }
  },
  "required": [
    "schemaVersion",
    "schema",
    "lenders"
  ],
  "description": "Phobos Banking lenders pack: who lends where, to whom and on what terms. Terms are copied into a loan when it is taken."
}
